{
  "$schema": "https://aiteam-x.inosx.io/schemas/agent-visual.v1.json",
  "color": {
    "from": "#fde68a",
    "to": "#b45309",
    "ink": "#451a03"
  },
  "accentHex": "#b45309",
  "glyphLetter": "S",
  "glyphPath": "M 35 25 L 65 25 L 65 35 L 45 35 L 45 45 L 65 45 L 65 75 L 35 75 L 35 65 L 55 65 L 55 55 L 35 55 Z"
}
