{
  "$schema": "https://aiteam-x.inosx.io/schemas/agent-visual.v1.json",
  "color": {
    "from": "#bfdbfe",
    "to": "#1d4ed8",
    "ink": "#172554"
  },
  "accentHex": "#1d4ed8",
  "glyphLetter": "A",
  "glyphPath": "M 30 35 Q 50 20 70 35 L 70 65 Q 50 80 30 65 Z M 40 45 L 44 45 M 56 45 L 60 45"
}
