{
  "$schema": "https://aiteam-x.inosx.io/schemas/agent-visual.v1.json",
  "color": {
    "from": "#bae6fd",
    "to": "#0284c7",
    "ink": "#082f49"
  },
  "accentHex": "#0284c7",
  "glyphLetter": "E",
  "glyphPath": "M 30 25 L 70 25 L 70 35 L 42 35 L 42 45 L 65 45 L 65 55 L 42 55 L 42 65 L 70 65 L 70 75 L 30 75 Z"
}
