{
  "$schema": "https://aiteam-x.inosx.io/schemas/agent-visual.v1.json",
  "color": {
    "from": "#fed7aa",
    "to": "#b45309",
    "ink": "#451a03"
  },
  "accentHex": "#b45309",
  "glyphLetter": "J",
  "glyphPath": "M 30 35 A 12 12 0 1 1 30 59 A 12 12 0 1 1 30 35 M 42 47 H 78 M 72 47 V 60 M 64 47 V 55"
}
