{
  "$schema": "https://aiteam-x.inosx.io/schemas/agent-visual.v1.json",
  "color": {
    "from": "#fed7aa",
    "to": "#ea580c",
    "ink": "#431407"
  },
  "accentHex": "#ea580c",
  "glyphLetter": "H",
  "glyphPath": "M 20 50 Q 35 30 55 35 Q 70 40 78 50 Q 60 55 45 52 Q 55 65 50 75 Q 40 65 35 58 Q 25 58 20 50 Z"
}
